{
  "schema_version": "miskatonic.representation-custody-closure.v0.1",
  "closure_id": "representation-custody-closure-01c-r1-r1",
  "work_order": "WO-MATH-FORMAL-DISCOVERY-01C-R1-R1",
  "predecessor_head": "1097bd5c1b165184bdfdd7323f8e2e7c25699f3c",
  "original_01c_commit_a": "ecbbfc0138e867b27ffd3110e6589a95eeb1f446",
  "original_01c_commit_b": "712f0d3ce27dbf4578d79f58b938bdc22ba69eeb",
  "original_01c_commit_a_tree": "f6c6eb396ce8298cf3370a8916d827d2fe0b2eec",
  "original_01c_commit_b_tree": "75c1f3ceb199f1ed23d7a14d277f1ba550a1f1c2",
  "candidate_id": "macro_mul_one_add_zero",
  "candidate_artifact_digest": "273a1d821e54ba6bf1832a2f1f11b338853aa9d1070d873c8b29345ba5aae903",
  "original_preregistration_ref": "experiments/formal-discovery-01c/preregistration.json",
  "original_preregistration_digest": "bd30fa638f7691c63d395337d9cf770a4d720596dae9647905662f533ed5ed15",
  "original_semantic_families_ref": "experiments/formal-discovery-01c/semantic-families.json",
  "original_semantic_families_digest": "16e65651439d3253542c9eb0711acd692c91727047927395aab96d45b1fbd5ea",
  "original_result_ref": "experiments/formal-discovery-01c/result.json",
  "original_result_digest": "1455687bb385b75a01fb9c8c29158b3de6151878e0124c1af7c8a5faab7f68a8",
  "original_paired_manifest_ref": "experiments/formal-discovery-01c/paired-representation-orbit-manifest.v0.1.json",
  "original_paired_manifest_digest": "671e7069aad34d4b776312a293c54e7d0798c20fedb3ee9079aa241f84cfdb93",
  "original_closure_manifest_ref": "experiments/formal-discovery-01c/representation-invariance-closure.v0.1.json",
  "original_closure_manifest_digest": "896588d4b34e44222eb5f982335b7e6bbbe9a5ac9f1d3c473bbec525764e3186",
  "original_onto_export_ref": "experiments/formal-discovery-01c/onto-export-scoped.json",
  "original_onto_export_digest": "7357580c96371a1512a9a8598caeb77f7bf6d1d78d587f8c30959ba086f8706f",
  "whole_problem_transform_manifest_ref": "experiments/formal-discovery-01c-r1-r1/whole-problem-transform-manifest.v0.1.json",
  "whole_problem_transform_manifest_digest": "53843bf060f3cfbabd53df1a28c473c21929ca1961fd0acce8e5178c73463dc4",
  "application_replay_manifest_ref": "experiments/formal-discovery-01c-r1-r1/application-replay-custody-manifest.v0.1.json",
  "application_replay_manifest_digest": "04b098e46584de8f6eff5da10989b700c509ba88f503896c45fc5344eef1bdf7",
  "transform_receipt_count": 48,
  "search_receipt_count": 96,
  "all_original_transform_receipts_verified": true,
  "all_original_search_receipts_verified": true,
  "exact_original_application_attempts_resolved": 169,
  "overwritten_or_unresolvable_application_attempts": 359,
  "per_stratum_dispositions": {
    "R0_CANONICAL_CONTROL": "REPRESENTATION_STRATUM_INVARIANT",
    "R1_ALPHA_RENAMED": "REPRESENTATION_STRATUM_INVARIANT",
    "R2_ASSOCIATIVE_REGROUPED": "REPRESENTATION_STRATUM_INVARIANT",
    "R3_COMMUTATIVE_MIRROR": "REPRESENTATION_STRATUM_SENSITIVE"
  },
  "global_disposition": "REPRESENTATION_INVARIANCE_NOT_SUPPORTED",
  "representation_invariance_scope": "ALPHA_ASSOCIATIVE_COMMUTATIVE_IDENTITY_ORBIT_V0_1",
  "functional_search_benefit_scope": "NODE_EXPANSION_SEARCH_STRUCTURE",
  "end_to_end_runtime_benefit": "NOT_ESTABLISHED",
  "claim_ceiling": "ENGINEERING_ABSTRACTION_EFFECT_ONLY",
  "authority": "NONE",
  "closure_status": "REPRESENTATION_CUSTODY_GRAPH_CLOSED",
  "closure_digest": "9fce2d1d804ea7d3c8dfb2dfc0ca44eaa9e6438c462a9bdc50d74d378e699ade",
  "original_r1_commit_a": "89fc1d6e4f290af0e8b4a61bc753efce04170526",
  "original_r1_commit_b": "1097bd5c1b165184bdfdd7323f8e2e7c25699f3c",
  "original_r1_commit_a_tree": "231b157807531345e792ab13a3fb3d1730137693",
  "original_r1_commit_b_tree": "11de77b7b2f679212f0cb630cc071da8d3291010",
  "original_r1_closure_manifest_ref": "experiments/formal-discovery-01c-r1/representation-custody-closure.v0.1.json",
  "original_r1_closure_manifest_digest": "ac06e32b19eb4c27fa240211e7ecc043dd00f132b0a926ab7b52d3e3241fd6e3",
  "search_replay_receipt_count": 48,
  "application_replay_receipt_count": 528,
  "all_replay_search_receipts_verified": true,
  "all_replay_application_receipts_verified": true,
  "all_applied_count_parity_verified": true,
  "all_search_budget_parity_verified": true,
  "search_budget_digest": "33e3063843806441f4193971b31f4c3093393af722d83f8f95cc11ff669f9635",
  "original_attempt_body_custody": "PARTIAL_AND_EXPLICIT",
  "deterministic_replay_attempt_body_custody": "COMPLETE"
}